{
  "$schema": "http://json-schema.org/draft-07/schema#",
  "$id": "https://github.com/Raaniscool/LuauNotes/schemas/knowledge-entry.schema.json",
  "title": "LuauNotes Knowledge Entry",
  "description": "Schema for a single knowledge entry in the LuauNotes knowledge base. Each entry lives in knowledge/<category>/<id>.json. The validator in app/lib/validate.js enforces these rules (and a few extras such as cross-link integrity) before content is accepted into the library.",
  "type": "object",
  "required": ["id", "title", "category", "type", "summary", "tags", "verification", "explanation", "added"],
  "properties": {
    "id": {
      "type": "string",
      "pattern": "^[a-z0-9][a-z0-9-]*$",
      "description": "Unique kebab-case identifier. Must match the file name (without .json) and be unique across the whole library."
    },
    "title": {
      "type": "string",
      "minLength": 1,
      "description": "Human-readable title, e.g. 'RemoteEvent', 'debounce', 'string.sub()'."
    },
    "category": {
      "type": "string",
      "enum": ["luau", "services", "classes", "methods", "events", "properties", "datatypes", "concepts", "patterns", "gotchas", "debugging"],
      "description": "Top-level library section. Drives sidebar grouping and validation rules."
    },
    "type": {
      "type": "string",
      "enum": ["concept", "class", "service", "method", "event", "property", "datatype", "pattern", "gotcha", "function", "keyword", "library", "overview"],
      "description": "What kind of thing this entry describes. Independent of category."
    },
    "summary": {
      "type": "string",
      "minLength": 10,
      "description": "One or two sentence summary shown in search results, cards, and lists."
    },
    "keywords": {
      "type": "array",
      "items": { "type": "string" },
      "description": "Search phrases / synonyms that should strongly match this entry (e.g. 'player parameter' on OnServerEvent)."
    },
    "tags": {
      "type": "array",
      "items": { "type": "string" },
      "minItems": 1,
      "description": "Short lowercase labels used for filtering and discovery."
    },
    "verification": {
      "type": "object",
      "required": ["status"],
      "properties": {
        "status": {
          "type": "string",
          "enum": ["verified", "review", "pending"],
          "description": "verified = checked against the cited source. review = believed correct, needs a verification pass. pending = unreviewed proposal (e.g. AI-generated) — always shown with a warning badge."
        },
        "source": { "type": ["string", "null"], "description": "Authoritative source name, e.g. 'Roblox Creator Documentation'." },
        "sourceUrl": { "type": ["string", "null"], "description": "URL of the authoritative documentation. Required for verified Roblox API entries (services/classes/methods/events/properties/datatypes)." },
        "lastVerified": { "type": ["string", "null"], "pattern": "^\\d{4}-\\d{2}-\\d{2}$", "description": "Date the entry was last checked against the source." },
        "notes": { "type": "string", "description": "Version notes, caveats, history." }
      },
      "description": "Provenance and verification metadata. NEVER present unverified information as verified."
    },
    "deprecated": {
      "type": "object",
      "properties": {
        "isDeprecated": { "type": "boolean" },
        "replacement": { "type": ["string", "null"], "description": "API or approach to use instead." },
        "notes": { "type": "string" }
      },
      "description": "Deprecation state. Present only when meaningful."
    },
    "reference": {
      "type": "object",
      "description": "Precise technical facts: signatures, parameters, members, behavior. This is the 'verified reference' layer.",
      "properties": {
        "signature": { "type": ["string", "null"], "description": "Primary call signature, e.g. 'RemoteEvent:FireServer(...args)'." },
        "syntax": { "type": "array", "items": { "type": "string" }, "description": "Syntax forms shown as code." },
        "parameters": {
          "type": "array",
          "items": {
            "type": "object",
            "required": ["name", "description"],
            "properties": {
              "name": { "type": "string" },
              "type": { "type": "string" },
              "default": { "type": ["string", "null"] },
              "description": { "type": "string" }
            }
          }
        },
        "returns": { "type": ["string", "null"], "description": "Return value description (may contain backticked code)." },
        "methods": { "type": "array", "items": { "type": "object", "required": ["name", "description"], "properties": { "name": {"type":"string"}, "signature": {"type":"string"}, "description": {"type":"string"} } } },
        "properties": { "type": "array", "items": { "type": "object", "required": ["name", "description"], "properties": { "name": {"type":"string"}, "type": {"type":"string"}, "description": {"type":"string"} } } },
        "events": { "type": "array", "items": { "type": "object", "required": ["name", "description"], "properties": { "name": {"type":"string"}, "signature": {"type":"string"}, "description": {"type":"string"} } } },
        "details": { "type": "array", "items": { "type": "object", "required": ["heading", "body"], "properties": { "heading": {"type":"string"}, "body": {"type":"string"} } }, "description": "Extra technical notes: replication, limits, restrictions, thread behavior." }
      }
    },
    "explanation": {
      "type": "object",
      "required": ["whatItIs"],
      "description": "The teaching layer: human-friendly, beginner-accessible. May simplify — must never contradict the reference layer.",
      "properties": {
        "whatItIs": { "type": "string", "minLength": 10 },
        "whyItExists": { "type": ["string", "null"] },
        "whenToUse": { "type": "array", "items": { "type": "string" } },
        "whenNotToUse": { "type": "array", "items": { "type": "string" } },
        "mentalModel": { "type": ["string", "null"], "description": "Visual/plain-language model. Supports fenced ``` diagrams." },
        "tips": { "type": "array", "items": { "type": "string" } },
        "commonMistakes": { "type": "array", "items": { "type": "string" } }
      }
    },
    "examples": {
      "type": "array",
      "items": {
        "type": "object",
        "required": ["title", "language", "code"],
        "properties": {
          "title": { "type": "string" },
          "description": { "type": "string" },
          "language": { "type": "string", "default": "lua" },
          "code": { "type": "string", "minLength": 1 },
          "whyItWorks": { "type": "string" },
          "commonMistake": { "type": "string" }
        }
      }
    },
    "related": {
      "type": "array",
      "items": { "type": "string" },
      "description": "IDs of related entries. Validated: every ID must exist in the library."
    },
    "puzzles": {
      "type": "array",
      "description": "Optional learning puzzles attached to this entry (future DukeOTR feature).",
      "items": {
        "type": "object",
        "required": ["kind", "prompt"],
        "properties": {
          "kind": { "type": "string", "enum": ["debugging", "predict-output", "complete-code", "client-or-server", "api-identification", "code-reading", "build-a-system"] },
          "prompt": { "type": "string" },
          "code": { "type": "string" },
          "options": { "type": "array", "items": { "type": "string" } },
          "answer": { "type": "string" },
          "explanation": { "type": "string" }
        }
      }
    },
    "added": {
      "type": "string",
      "pattern": "^\\d{4}-\\d{2}-\\d{2}$",
      "description": "Date the entry was added to the library."
    }
  }
}
