{
  "id": "user-input-service",
  "title": "UserInputService",
  "category": "services",
  "type": "service",
  "summary": "Client-only input hub: keyboard, mouse, touch, and gamepad events (InputBegan/Changed/Ended), plus device capability checks like TouchEnabled and GetMouseLocation.",
  "keywords": [
    "input",
    "keyboard",
    "KeyCode",
    "InputBegan",
    "touch",
    "gamepad",
    "mouse location",
    "key pressed"
  ],
  "tags": [
    "services",
    "input",
    "client"
  ],
  "verification": {
    "status": "verified",
    "source": "Roblox Creator Documentation",
    "sourceUrl": "https://create.roblox.com/docs/reference/engine/classes/UserInputService",
    "lastVerified": "2026-10-04",
    "notes": ""
  },
  "reference": {
    "events": [
      {
        "name": "InputBegan",
        "signature": "UserInputService.InputBegan:Connect(function(input: InputObject, gameProcessed: boolean) end)",
        "description": "Fires when any input starts (key press, touch, button). gameProcessed=true means the engine already used it (e.g. chat box open, controls)."
      },
      {
        "name": "InputChanged",
        "signature": "UserInputService.InputChanged:Connect(function(input: InputObject, gameProcessed: boolean) end)",
        "description": "Fires while input continues/moves (mouse movement, thumbstick)."
      },
      {
        "name": "InputEnded",
        "signature": "UserInputService.InputEnded:Connect(function(input: InputObject, gameProcessed: boolean) end)",
        "description": "Fires when input is released."
      }
    ],
    "properties": [
      {
        "name": "TouchEnabled",
        "type": "boolean",
        "description": "Device supports touch."
      },
      {
        "name": "GamepadEnabled / KeyboardEnabled / MouseEnabled",
        "type": "boolean",
        "description": "Device capability flags."
      },
      {
        "name": "MouseDeltaSensitivity",
        "type": "number",
        "description": "Scales mouse delta values."
      }
    ],
    "methods": [
      {
        "name": "GetMouseLocation",
        "signature": "UserInputService:GetMouseLocation() --> Vector2",
        "description": "Current mouse position in screen pixels (client)."
      },
      {
        "name": "IsKeyDown",
        "signature": "UserInputService:IsKeyDown(keyCode: Enum.KeyCode) --> boolean",
        "description": "Poll whether a key is currently held."
      },
      {
        "name": "IsGamepadButtonDown",
        "signature": "UserInputService:IsGamepadButtonDown(gamepad: Enum.UserInputType, button: Enum.KeyCode) --> boolean",
        "description": "Poll gamepad buttons."
      }
    ]
  },
  "explanation": {
    "whatItIs": "The raw feed of everything the player physically does: presses, clicks, taps, stick tilts. Client-side only, because input happens on the player's machine.",
    "whyItExists": "Gameplay starts with input. UIS gives one event-driven API across every device type.",
    "whenToUse": [
      "Custom abilities/spells bound to keys",
      "Mobile detection (TouchEnabled) to adapt UI",
      "Mouse position for custom crosshairs or drag logic",
      "Combining with ContextActionService for cross-device bindings"
    ],
    "whenNotToUse": [
      "Server-side — input only exists on clients; send intents via remotes",
      "When you want automatic touch buttons for mobile — that's ContextActionService's job"
    ],
    "mentalModel": "```text\nInputBegan fires for EVERY input:\n  input.KeyCode   → which key/button (Enum.KeyCode.W)\n  input.UserInputType → what kind (Keyboard / MouseButton1 / Touch)\n  gameProcessed   → did Roblox already consume it?\n\nif gameProcessed then return end   ← standard first line\n```",
    "tips": [
      "Always check `gameProcessed` before acting, or your keybind fires while typing in chat",
      "Track held state with InputBegan/InputEnded pairs, or poll IsKeyDown in a loop",
      "For gameplay actions supporting mobile + gamepad, prefer ContextActionService"
    ],
    "commonMistakes": [
      "Ignoring gameProcessed → abilities trigger while typing in chat",
      "Using UIS in a Script (server) — it's client-only",
      "Binding to Enum.KeyCode.LeftMouseButton instead of checking UserInputType.MouseButton1"
    ]
  },
  "examples": [
    {
      "title": "Keybind with gameProcessed guard",
      "code": "local UserInputService = game:GetService(\"UserInputService\")\n\nUserInputService.InputBegan:Connect(function(input, gameProcessed)\n    if gameProcessed then return end   -- chat/controls already used it\n\n    if input.KeyCode == Enum.KeyCode.E then\n        print(\"E pressed — interact!\")\n    elseif input.UserInputType == Enum.UserInputType.MouseButton1 then\n        print(\"Left click!\")\n    end\nend)",
      "language": "lua"
    },
    {
      "title": "Device-aware UI",
      "code": "local UserInputService = game:GetService(\"UserInputService\")\n\nif UserInputService.TouchEnabled then\n    print(\"Mobile layout: show big touch buttons\")\nelse\n    print(\"Desktop layout: show keybind hints\")\nend",
      "language": "lua"
    }
  ],
  "related": [
    "context-action-service",
    "input-began",
    "localscript",
    "client-vs-server",
    "proximity-prompt-interaction"
  ],
  "added": "2026-10-04"
}
